input,intent
I need to cancel that appointment the problem seems to be fixed,cncl appt
I want you to cancel please cancel the appointment,cncl appt
Need to cancel it box is working cable's working,cncl appt
Calling to cancel the order,cncl appt
Help the appointment been canceled,cncl appt
Yes appointment been cancel,cncl appt
Cancel the fucking appointment,cncl appt
No we just need to cancel out the appointment,cncl appt
I need to cancel the appointment because I'm sick,cncl appt
Canceling canceling it,cncl appt
I received a message saying that everything was okay so do I cancel my appointment or do I keep it,cncl appt
I would like to cancel the appointment the phone is working,cncl appt
I need to cancel the appointment for some reason my Internet came back on,cncl appt
It's already fed so I don't need your help,cncl appt
I want to make sure that I didn't cancel it,cncl appt
I don't like that appointment I do not want that appointment,cncl appt
Cancellation please,cncl appt
Cancel my appointment what was that,cncl appt
I'm gonna cancel the appointment my TV started working,cncl appt
I wish to cancel I wish to cancel,cncl appt
I need to cancel my appointment I no longer NEJM,cncl appt
Internet access I want to cancel it,cncl appt
Can I cancel that appointment cancel,cncl appt
You don't half to come left stations have come back on we don't need an appointment this time,cncl appt
To cancel that appointment,cncl appt
I'm going to had to cancel an time and emergency,cncl appt
I'd like to cancel I'd like to cancel it,cncl appt
I need to cancel my appointment my cable to come back dollar,cncl appt
Please cancel I do not wish to get service with spectrum,cncl appt
No I don't need that I R,cncl appt
I don't have a appointment and cancel it I'm not getting the service,cncl appt
I'd like to cancel the appointment for this morning,cncl appt
Yes but I don't wanna,cncl appt
I need to cancel plan link and you can't correct two,cncl appt
Cancel I need to cancel close my account,cncl appt
I need to cancel it I need to cancel it,cncl appt
I need euro I want to cancel my appointment,cncl appt
