input,intent
No I'm calling to make sure TV,cnfm appt
Can I call the technician,cnfm appt
No they just called here and I was wondering what they want it,cnfm appt
Thanks confirm,cnfm appt
That's what I needed to know thank you very much,cnfm appt
Dispatch,cnfm appt
Dispatch please,cnfm appt
Received a call calling back,cnfm appt
No thank you have a good day,cnfm appt
No good have dogs calling you for the getting to come this way,cnfm appt
I just want to know what time,cnfm appt
Details,cnfm appt
Change the time of the appointment,cnfm appt
That's fine just wanted to know what time thank you,cnfm appt
I was just calling to make sure he was on his way so I could be there wait for,cnfm appt
That's great I'm I'm waiting for him but you called me I didn't call you,cnfm appt
Just confirming,cnfm appt
I received a phone call saying he could not come at that hour I need to know when he's coming,cnfm appt
Just calling to see what time,cnfm appt
Just confirming the appointment,cnfm appt
I have not received the modem to be hooked up,cnfm appt
Just making sure it's confirmed,cnfm appt
Check status,cnfm appt
No that's correct thank you,cnfm appt
Yeah I find my time,cnfm appt
If there's any more problems I'll call you back thank you,cnfm appt
I thought my appointment was at eight a.m.,cnfm appt
None at the moment of anything thing should happen will call back thank you,cnfm appt
Appointment time,cnfm appt
I want to check,cnfm appt
I just want to make sure that's it,cnfm appt
I want to verify that he's coming,cnfm appt
I just wanted to verify that he is coming,cnfm appt
Check my Internet status,cnfm appt
Technical support I will call you tomorrow,cnfm appt
Okay that's fine I just want to check to make sure someone's coming thank you,cnfm appt
I'm just calling to confirm that I would like to keep it,cnfm appt
J D appointment time,cnfm appt
No I want to keep my appointment tell me what date and time,cnfm appt
Can you tell me what time my appointment is what day,cnfm appt
I'm trying to see how to connect with Wi-Fi tomorrow number,cnfm appt
Tell me what time my appointment is,cnfm appt
No I wanna know what time my appointment is,cnfm appt
No I want I want to know what time my appointment is,cnfm appt
No I want to know when my appointment is well tell me what time my appointment is what day,cnfm appt
Tell me tell me what day it was,cnfm appt
My supposed to be here today,cnfm appt
I want doctor appointment,cnfm appt
Call appointment,cnfm appt
Somebody called me from there,cnfm appt
There is no technician,cnfm appt
There's no technician,cnfm appt
No technician,cnfm appt
No just waiting for the technician to come,cnfm appt
Confirm address,cnfm appt
Confirm my address,cnfm appt
Confirm address,cnfm appt
Confirm address,cnfm appt
Confirm address,cnfm appt
Confirm address,cnfm appt
I just want to tell you they Zelle,cnfm appt
The tech didn't missed appointment,cnfm appt
What are they calling for I don't I didn't call them to come why why why do I need somebody to come,cnfm appt
I was told that I was gonna have the technician here Saturday not Sunday I've been out my cable all weekend,cnfm appt
Updating arrival time,cnfm appt
No I don't need help I'm just waiting for my appointment,cnfm appt
I want to know what Velveeta,cnfm appt
Call me,cnfm appt
No messages left his disappointment for laboratory events I would need to know right now,cnfm appt
What is the technician coming to,cnfm appt
Never mind just confirming,cnfm appt
Tell me,cnfm appt
Technician technician came here,cnfm appt
Appointment time is wrong,cnfm appt
Appointment time is wrong,cnfm appt
Supervisor I would like to have the plate,cnfm appt
Just to confirm that I'm gonna be here,cnfm appt
Just confirming thank you,cnfm appt
To see if a technician is coming tonight,cnfm appt
I wondered if the technician could come tonight,cnfm appt
Boston supposed to be today,cnfm appt
I'm calling to confirm my appointment,cnfm appt
I just want to know what time it was common,cnfm appt
No loving to do a scheduled appointment,cnfm appt
Status,cnfm appt
I just thought you might call your trying to get a tech out today instead of my appointment tomorrow and I just thought maybe you were trying to get a hold of me,cnfm appt
Confirm appointment,cnfm appt
No I want to know that I make contact with everybody showing up,cnfm appt
It's almost six p.m. can you tell me please,cnfm appt
Technician now,cnfm appt
Technician,cnfm appt
Going on four thirty and he hadn't called her InnerDyne,cnfm appt
Confirm I'm confirming it now,cnfm appt
I'm all set this is going to be here at six o'clock correct,cnfm appt
Is the technician gonna be here today at six p.m.,cnfm appt
Date please,cnfm appt
I no need for appointment I just wanted to be sure that someone would be here tomorrow thank you,cnfm appt
Thank you that's my that's it that's all I wanted to know thank you,cnfm appt
I just wanted to be sure I was still they were still coming everything's fine that's what you just read it to me,cnfm appt
Let me know more of the correct time he will arrive here,cnfm appt
Technician,cnfm appt
I just wanted to confirm it,cnfm appt
About the appointment,cnfm appt
Just confirming,cnfm appt
Where is the technician,cnfm appt
Right my technician,cnfm appt
Is the technician on the way,cnfm appt
I was just wondering the time,cnfm appt
What time is my appointment,cnfm appt
About appointment,cnfm appt
G to someone,cnfm appt
Pick to someone,cnfm appt
Just wanna confirm it,cnfm appt
Well someone called me to tell me everything was fixed but it's not fixed,cnfm appt
I had a phone call this morning about having somebody come out today,cnfm appt
It was supposed to be today,cnfm appt
Caldwell technician,cnfm appt
Just checking to see if the list still available,cnfm appt
And I think to a technician please,cnfm appt
Confirm appointment,cnfm appt
Time,cnfm appt
Directions for driver technician,cnfm appt
Confirm appointment,cnfm appt
No I don't know it right now kids back home for a long long time,cnfm appt
I like to have somebody else now,cnfm appt
The problems the problems been six is okay this technician does not come,cnfm appt
They were supposed to be here today between four 3 and 4 and I'm sitting here waiting for him,cnfm appt
Someone was supposed to come out today,cnfm appt
About appointment confirmation,cnfm appt
It's close to be I just left the store and they set it up for two o'clock today at December ninth,cnfm appt
I said the appointment was supposed to be today at two o'clock,cnfm appt
Compaq technician,cnfm appt
Just verifying,cnfm appt
I want to make sure make sure the technician knows I'm on my way,cnfm appt
You guys called me,cnfm appt
About dot technician,cnfm appt
The technician did not show up yet,cnfm appt
No I was trying to verify,cnfm appt
No but I need to know for sure and what time,cnfm appt
I want to know if we did finish it coming today or no,cnfm appt
Confirmation,cnfm appt
I'm asking why my appointment was changed,cnfm appt
I originally had an appointment for,cnfm appt
I have done a call,cnfm appt
I need to know when he'll be here,cnfm appt
Checking status,cnfm appt
Well two o'clock in is not here yet I'm just wondering if they would come,cnfm appt
I won't be at home for the appointment,cnfm appt
I'm waiting on the check,cnfm appt
Just checking to make sure you get here,cnfm appt
I want to know that someone's coming,cnfm appt
I wanna know if he's coming today if not I want my money back,cnfm appt
I wanna know when the guys coming,cnfm appt
Which address should be you know technician because,cnfm appt
That was it I just want to confirm it,cnfm appt
I want to know if there's anything sooner,cnfm appt
I just wanted to let you know that my phone isn't ringing in,cnfm appt
Yeah I was just checking on it so I'm just waiting on them both out,cnfm appt
No just confirming thank you,cnfm appt
I haven't had any confirmation from the technician,cnfm appt
Confirm appointment,cnfm appt
Confirm,cnfm appt
I will call them,cnfm appt
No I just want to verify appointment today from between three and four is that correct,cnfm appt
Today you have an appointment for today you have a date for today,cnfm appt
Appointment for tomorrow,cnfm appt
I mean the new appointment,cnfm appt
Confirm,cnfm appt
I just wanted to confirm that we do have an appointment tomorrow,cnfm appt
I received a call saying my TV was fixed but it's not and I do one three appointments tomorrow,cnfm appt
About the technician,cnfm appt
He hasn't knocked on the door,cnfm appt
Verify that I,cnfm appt
Traffic technician,cnfm appt
That's what I wanted to know I forgot the time thank you,cnfm appt
How far date,cnfm appt
Yes confirming the appointment,cnfm appt
Just wanted to check order,cnfm appt
Okay that's all I wanted to know,cnfm appt
That's that's it I wanted to know if it was still he was still coming today,cnfm appt
You called me I was calling you back,cnfm appt
Make a date,cnfm appt
To confirm appointment,cnfm appt
Technician,cnfm appt
Call the technician gonna do,cnfm appt
Call the technician,cnfm appt
Someone was supposed to call me today for between nine thirty and ten technician and he has not called me,cnfm appt
What time is he coming,cnfm appt
Confirm appointment time,cnfm appt
I just want to know the time,cnfm appt
I was just making sure because I didn't get a text,cnfm appt
Confirmation number,cnfm appt
Thank you what I needed to know,cnfm appt
I just wanna make sure he's going to be here at eleven o'clock,cnfm appt
I need the name of the person coming to my home,cnfm appt
When will the as the technician on the way,cnfm appt
I want to confirm it,cnfm appt
Confirm,cnfm appt
Work order,cnfm appt
I got a call from,cnfm appt
I'm just calling to confirm the appointment,cnfm appt
I'm just confirming it,cnfm appt
I'm just calling to confirm it,cnfm appt
Confirm,cnfm appt
I don't know that I've never I don't know that,cnfm appt
When is my appointment,cnfm appt
Yes yes I'm calling today,cnfm appt
Reason for technician,cnfm appt
How far away is my installer,cnfm appt
Just to confirm I'm conforming,cnfm appt
That's all I wanted to know,cnfm appt
To confirm appointment,cnfm appt
Just wanted to check I just wanted to check to see if they was coming still,cnfm appt
No changes just checking in,cnfm appt
You called me,cnfm appt
Traffic call me I want to reply back,cnfm appt
I just wanted to confirm the appointment,cnfm appt
U U Y you know what someone said day,cnfm appt
Confirm,cnfm appt
Yes please confirm,cnfm appt
The technician minutes,cnfm appt
What time is it,cnfm appt
I want to know if you come in yet,cnfm appt
I just want to know what time,cnfm appt
No dance bar I just want to know what time,cnfm appt
It's just fine I'm just I just wanna make sure he comes,cnfm appt
I just wanna make sure he's coming,cnfm appt
Verify,cnfm appt
Oh that's it I just wanted to confirm that,cnfm appt
Can you tell me exactly how soon will be here what this is Ralf right now,cnfm appt
Appointment time is wrong,cnfm appt
I want to know why I had a call,cnfm appt
Yeah you know why they called our diagramming,cnfm appt
Confirm appointment,cnfm appt
Please confirm appointment,cnfm appt
Just make sure it's confirmed,cnfm appt
Just confirm it,cnfm appt
I know I'll be waiting for the guy to get here,cnfm appt
You called me,cnfm appt
Just wanted to confirm,cnfm appt
Okay when are they coming out,cnfm appt
That's fine I'm just I'm gratis confirmed,cnfm appt
Just confirming,cnfm appt
I need to know what this appointment is for,cnfm appt
Yes and I was just making sure I had appointment,cnfm appt
I'll be here for the appointment in the afternoon between five and six I never made an appointment for this morning,cnfm appt
I'm just confirming,cnfm appt
I don't know it don't have a security code,cnfm appt
My work order is wrong,cnfm appt
I want to check the call back number,cnfm appt
I want to know when it was supposed to be that's all,cnfm appt
Just wanted to know what time,cnfm appt
I'd like to know which technician will appear to be coming in today to my house,cnfm appt
Confirm,cnfm appt
I'm calling about my package deal my Internet and what they're gonna be doing that's all I need to know,cnfm appt
Appointment time again,cnfm appt
Confirm my appointment,cnfm appt
We're we're confirmed goodbye,cnfm appt
Service has not been restored,cnfm appt
It's that's it's confirmed,cnfm appt
No way that you don't have a 11 and 2 noon,cnfm appt
About the appointment,cnfm appt
I would call me now at this number,cnfm appt
Do you have an appointment for later in the afternoon instead of in the morning,cnfm appt
Do you have an appointment for later in the afternoon,cnfm appt
Verify,cnfm appt
You just did you verify my appointment,cnfm appt
No it's okay confirmed eight nine one,cnfm appt
Just to confirm,cnfm appt
Correct,cnfm appt
Go I got to go to doctors so mad at me at least six p.m.,cnfm appt
I was told someone was gonna call me about getting an emergency service done and I have not been called,cnfm appt
Just to verify,cnfm appt
My cable was cut off by your technician,cnfm appt
Add a service call,cnfm appt
Are they going to call me,cnfm appt
They going to call me,cnfm appt
I wanna know if they have a power booster,cnfm appt
Confirm appointment,cnfm appt
I know,cnfm appt
I want to correct my,cnfm appt
Destin correct that's incorrect my appointment is December fifteenth between three and four p.m.,cnfm appt
That's all I needed to know,cnfm appt
When I made the appointment,cnfm appt
When I made the appointment it was from 8 to 10,cnfm appt
I just got a call from Hugo,cnfm appt
I want to get out time when they were coming I thought they were coming tonight,cnfm appt
I just want to know when the technician will get there,cnfm appt
Next meet with someone,cnfm appt
Confirm address,cnfm appt
Call me everything thank you,cnfm appt
That's we wanted to confirm it,cnfm appt
Where's my technician,cnfm appt
There's already a technician here,cnfm appt
No I just want to know if he's gonna be here,cnfm appt
About the appointment,cnfm appt
Someone tried to call,cnfm appt
Good confirmed it's good,cnfm appt
That's all just want to make sure that that where she was coming,cnfm appt
Can you tell me if he's on the way,cnfm appt
Confirming,cnfm appt
I received a voicemail from a tech that I could not hear,cnfm appt
Just confirming my appointment,cnfm appt
That that's just want to know when it was still okay I'm waiting,cnfm appt
I'd like to know if he's on his way,cnfm appt
Just to confirm my appointment,cnfm appt
Calling about my appointment,cnfm appt
Man I want to tell about my telephone it's working now,cnfm appt
They just called me,cnfm appt
Just confirming,cnfm appt
Call for my appointment,cnfm appt
Close call me,cnfm appt
I just wanna know he's coming,cnfm appt
Where's my technician,cnfm appt
I just wanted to verify thank you I'll be here,cnfm appt
You have the number to the installer,cnfm appt
No I just want to know where the spectrum and is,cnfm appt
Tax I am tech technician is already on its way,cnfm appt
Looking for tech visit,cnfm appt
ETN for technician,cnfm appt
I need to know about a name change,cnfm appt
I just need to know what time you're coming,cnfm appt
That's what I needed to know I got disconnected,cnfm appt
Can I have a technician now,cnfm appt
Estimated time of arrival Dallas fort technician,cnfm appt
I need to see the technician yet,cnfm appt
Confirm,cnfm appt
No I'm calling I'm waiting I just got in the house and I'm waiting for the delay I love a woman the terms,cnfm appt
I just want to confirm my appointment,cnfm appt
It's Sunday I know on Sunday at two o'clock,cnfm appt
Confirming,cnfm appt
The guy has not come yet,cnfm appt
Call technician,cnfm appt
Call mike technician,cnfm appt
Nothing just verifying,cnfm appt
Neither different appointment time,cnfm appt
Technician,cnfm appt
When will the technician be here,cnfm appt
When will the technician be here,cnfm appt
There is no technician here,cnfm appt
Technician,cnfm appt
About the appointment,cnfm appt
They're supposed to be putting in a new drop,cnfm appt
Technician hasn't come,cnfm appt
That's it confirm,cnfm appt
Okay this technician will come,cnfm appt
Confirm,cnfm appt
No no okay my appointments for tomorrow between two and three correct technician correct,cnfm appt
Give me someone I could give me some,cnfm appt
Listen I want a technician here,cnfm appt
I just wanted to know when he would be here,cnfm appt
Okay thank you so that's what I wanted to know thank you,cnfm appt
I'm I'm good I just need to know the time and date,cnfm appt
I thought we would receive a confirmation text,cnfm appt
Okay we were just checking to see if he was coming,cnfm appt
I'd like to know what time,cnfm appt
Hi confirmation,cnfm appt
I'm all set confirmed,cnfm appt
Just making a technician,cnfm appt
What time is the technician coming,cnfm appt
No thank you I'll call I'll stay here waiting for him,cnfm appt
I just want to make sure,cnfm appt
That's okay I just need to know what time they become,cnfm appt
It really is not about my appointment it's about the service that we're gonna be getting,cnfm appt
I want to know what he still coming,cnfm appt
Well what time is it started working now,cnfm appt
Confirm appointment,cnfm appt
I am confirming confirm my appointment,cnfm appt
Confirm,cnfm appt
I just wanted to make sure I haven't been I'm not been scammed I want to make sure I was talking to spectrum,cnfm appt
Confirm,cnfm appt
Trying to verify someone is coming,cnfm appt
I'm validating my appointment,cnfm appt
No I'm trying to get my DVR I want to see Dingee I'm shooting and I wanna sleep TV,cnfm appt
Just confirming if they was coming or not,cnfm appt
Someone then this is fine,cnfm appt
Tell me the time like four thirty to five thirty two thirty to four thirty,cnfm appt
Call me when they're gonna come my S S I get Parady four thirty,cnfm appt
Yes appointment time was confirmed as it was between two and three so can you make a time,cnfm appt
The technician left something here,cnfm appt
Technician left something here,cnfm appt
Okay I'll call I'll call this morning about somebody saying they were doing hundred dollar,cnfm appt
I didn't know there was a technician coming I thought it was self install,cnfm appt
Oh that's perfect I was just trying to confirm it,cnfm appt
Confirming the appointment,cnfm appt
Just checking to make sure the technician was coming out today,cnfm appt
To see if the technician what's R,cnfm appt
Hello I just want to make sure that they were coming,cnfm appt
They were supposed to come today and they never called to tell me they were coming,cnfm appt
I missed the call from the tech but I just left warm thank you,cnfm appt
I'm okay I'm looking for my appointment,cnfm appt
Supposed to be today,cnfm appt
What time is my appointment,cnfm appt
Give me the time that you made the appointment,cnfm appt
Service call description service call,cnfm appt
Waiting on a technician,cnfm appt
Is there any other appointments today,cnfm appt
It is two o'clock and he has not showed up,cnfm appt
The technician has not showed up,cnfm appt
Local dispatch,cnfm appt
I was just calling to verify,cnfm appt
He's here and I'm waiting at the door from,cnfm appt
Do you have a sooner appointment,cnfm appt
Verify a contract,cnfm appt
I'm waiting for the technician is due to be near thirty minutes ago,cnfm appt
I'm just making sure they coming,cnfm appt
Thank you I just want to know are they coming,cnfm appt
Phone and I was just wondering when they come in,cnfm appt
I want to confirm the appointment,cnfm appt
I don't think I told me it was September the ninth between nine and ten and I just wanted to confirm,cnfm appt
I just wanna make sure that the technician comes on here like dollar,cnfm appt
Confirm,cnfm appt
Confirming,cnfm appt
Confirming,cnfm appt
The appointment is for between eight and nine a.m. tomorrow morning,cnfm appt
No technician here,cnfm appt
I just wanna make sure they'll be here,cnfm appt
I was told the appointment was Friday December eighth,cnfm appt
Confirming,cnfm appt
Correct,cnfm appt
Confirm,cnfm appt
Hi I'm just confirming that someone is coming at two p.m. to fix the television,cnfm appt
The technician is coming,cnfm appt
Just confirming,cnfm appt
Appointment time,cnfm appt
I got a text saying goes another appointment for tomorrow I'm calling about that one,cnfm appt
My appointment time,cnfm appt
Just tell me when they're coming,cnfm appt
I'm calling with details on my appointment,cnfm appt
Confirm,cnfm appt
What time is the appointment,cnfm appt
I don't know what the appointment is about,cnfm appt
Confirm appointment,cnfm appt
Tech department,cnfm appt
I would like to know if I can get an appointment sooner than Sunday is that possible please,cnfm appt
Give me the service tech department,cnfm appt
Regarding about the house we need technician outside to scrape the cable,cnfm appt
Just making sure they're coming,cnfm appt
Thank you I'm waiting I'm here waiting,cnfm appt
I was wondering make sure that the repair person no extra,cnfm appt
They were supposed to be here today,cnfm appt
I want to confirm my appointment,cnfm appt
I got a phone call from spectrum and I I just want to make sure he is coming,cnfm appt
I want to confirm it yes,cnfm appt
I just wanna double check that I'm still on the list of good to go for today,cnfm appt
No technician coming today,cnfm appt
I need to get a technician instructions,cnfm appt
Just wanted to confirm,cnfm appt
I had a technician call me,cnfm appt
Technician didn't show up,cnfm appt
That's all just checking on arrival time,cnfm appt
I'm just checking the status,cnfm appt
Date again,cnfm appt
You called me,cnfm appt
What security code I don't I didn't know I had one,cnfm appt
Oh I was just confirming,cnfm appt
No the date and time,cnfm appt
Appointment with a technician,cnfm appt
Close a technician,cnfm appt
I want to know,cnfm appt
God I want to confirm the appointment,cnfm appt
Confirm appointment,cnfm appt
I just wanted to make sure that it's,cnfm appt
No that's what I was asking about because they just called me thank you,cnfm appt
I need to make sure that a tech is sent to me,cnfm appt
There is one is one of those things I'm trying to get a hold of someone,cnfm appt
Give me a call,cnfm appt
I was just confirming you got school,cnfm appt
Yes I was just confirming that's all,cnfm appt
I need to know thank you,cnfm appt
You called me,cnfm appt
Do you know how much am I gonna pay,cnfm appt
Just confirming,cnfm appt
No no no thank you already confirmed thank you goodbye,cnfm appt
When will be will be technician call me when he arrives at my residence,cnfm appt
Just wanted to confirm it,cnfm appt
Thank you very much thank you I just wanted to confirm the appointment and you have done that,cnfm appt
I was just confirming that's all,cnfm appt
Derek technician is not here,cnfm appt
No thank you have a good day,cnfm appt
That's all just want to make sure they're coming,cnfm appt
Checking the time,cnfm appt
We received a call earlier and we just wanted to make sure everything was still alright,cnfm appt
Nothing I just wanted to make sure it was confirmed,cnfm appt
Just want to confirm that I'm ready for him to come read ready,cnfm appt
Call so I wanted,cnfm appt
You called me,cnfm appt
Okay confirmed,cnfm appt
You called me,cnfm appt
About the time frame is it worth I had to go back to work at one o'clock,cnfm appt
Technician needs to bring a spectrum router,cnfm appt
I didn't ask for the appointment,cnfm appt
Confirming it,cnfm appt
Time is wrong last name is wrong on my account,cnfm appt
Confirmation,cnfm appt
No I just wanted to know the time that if I was correct and that is correct thank you,cnfm appt
Oh okay thank you that's what I needed to know,cnfm appt
Tell me,cnfm appt
Date,cnfm appt
I wanna make sure they're bringing the old-school black box and not the new one,cnfm appt
Have the technician bring my modem,cnfm appt
You tell me tonight thank you have a nice day,cnfm appt
I just got I just wanna confirm that yes,cnfm appt
I just received a call from this number and I called her back and find out what,cnfm appt
This is correct,cnfm appt
I don't know my security code I don't know it,cnfm appt
That's not that's not what my appointment time was,cnfm appt
We were already told her appointment was for four p.m. we are not going to be there at ten a.m.,cnfm appt
Confirm,cnfm appt
I just confirmed yet,cnfm appt
When was supposed to call me back and I didn't,cnfm appt
Didn't receive a call back,cnfm appt
Call me to appointment,cnfm appt
Haitian date,cnfm appt
Date,cnfm appt
I missed a call from the technician I need his phone number,cnfm appt
Technician phone number,cnfm appt
What time are they coming,cnfm appt
Well there was supposed to tell me yesterday they told me I don't I don't get channel ninety two and my picture would come back,cnfm appt
Tell me,cnfm appt
Okay what's the time,cnfm appt
Technician appointment,cnfm appt
Technician,cnfm appt
Okay hold on a minute like to check recent 10 to 11 right,cnfm appt
Is there any other appointments available,cnfm appt
Call me what's call me tomorrow at eight a.m. not today,cnfm appt
Go on somebody on the call please,cnfm appt
Correct,cnfm appt
I'd like to know what the box and house,cnfm appt
Just making sure they're coming today,cnfm appt
Where's my technician,cnfm appt
I just wanna make sure my comment line,cnfm appt
Get any calls from checking to see,cnfm appt
I don't want this three I don't have it on me,cnfm appt
It's confirmed thank you that's all I need,cnfm appt
Tell me if he's gone did he get out is he coming,cnfm appt
I have confirmed that,cnfm appt
End the call and call,cnfm appt
Confirm,cnfm appt
Where where's the technician going,cnfm appt
Details,cnfm appt
Status,cnfm appt
That's all I needed to know thank you,cnfm appt
I wanna know where he's going to be,cnfm appt
Where is my technician,cnfm appt
Just wanted to confirm it thank you,cnfm appt
Technician was unable to complete service,cnfm appt
Return product technician,cnfm appt
